{
  "$schema": "http://json-schema.org/draft-07/schema#",
  "title": "CerynixOS OTA Update Metadata",
  "type": "object",
  "properties": {
    "version": {
      "type": "string",
      "description": "The semantic version of the OS update (e.g. 1.1.0)",
      "pattern": "^[0-9]+\\.[0-9]+\\.[0-9]+$"
    },
    "release_date": {
      "type": "string",
      "format": "date-time",
      "description": "ISO 8601 timestamp of the release"
    },
    "iso_url": {
      "type": "string",
      "format": "uri",
      "description": "Direct download URL for the update bundle/ISO"
    },
    "sha256_hash": {
      "type": "string",
      "description": "SHA-256 checksum of the downloaded file for integrity verification"
    },
    "urgency": {
      "type": "string",
      "enum": ["low", "medium", "critical"],
      "default": "low",
      "description": "Determines if the update can be delayed or must be forced"
    },
    "changelog": {
      "type": "array",
      "items": {
        "type": "string"
      },
      "description": "List of user-facing changes to display in the GTK UI before installing"
    }
  },
  "required": ["version", "release_date", "iso_url", "sha256_hash", "urgency", "changelog"]
}
